{
  "analyzer": "KeywordAnalyzer",
  "customer_id": "topgolf_002",
  "analysis_period": {
    "start_date": "2025-08-01T00:00:00",
    "end_date": "2025-08-24T23:59:59"
  },
  "timestamp": "2025-08-24T12:20:13",
  "summary": {
    "total_keywords_analyzed": 12,
    "recommendations_count": 2,
    "potential_monthly_savings": 0,
    "priority_level": "LOW"
  },
  "detailed_findings": {
    "underperforming_keywords": [
      {
        "name": "golf lessons",
        "match_type": "EXACT",
        "cost": 0,
        "conversions": 0,
        "cpa": "N/A",
        "campaign": "TopGolf - Lessons",
        "recommendation": "No spend - Consider activating or removing"
      },
      {
        "name": "",
        "match_type": "BROAD",
        "cost": 123.45,
        "conversions": 0,
        "cpa": "N/A",
        "campaign": "",
        "recommendation": null
      }
    ],
    "top_performers": [
      {
        "name": "topgolf birthday party",
        "match_type": "PHRASE",
        "cost": 1234.56,
        "conversions": 100,
        "cpa": 12.35,
        "campaign": "TopGolf - Events",
        "recommendation": "Excellent performer - Scale up"
      }
    ],
    "recommendations": []
  }
}
